{
  "version": "1.0",
  "style_playbook": "clean-professional",
  "scenes": [
    {"id":"s01","type":"broll","description":"闹钟、未读书、手机滑动的三联生活切片","start_seconds":0,"end_seconds":28,"script_section_id":"hook","framing":"close-up montage","movement":"slow push-ins","transition_in":"fade","transition_out":"cut","overlay_notes":"你不是不自律","shot_intent":"让观众立即认出自己的失败循环","narrative_role":"build_tension","information_role":"建立共鸣","hero_moment":true,"required_assets":[{"type":"image","description":"三张生活困境概念图","source":"generate"}]},
    {"id":"s02","type":"talking_head","description":"讲述人正面提出核心问题","start_seconds":28,"end_seconds":55,"script_section_id":"hook","framing":"medium close-up","movement":"subtle push-in","transition_in":"cut","transition_out":"dissolve","overlay_notes":"为什么知道该做，却总是坚持不了？","shot_intent":"把共鸣转成明确观看承诺","narrative_role":"deliver_payload","information_role":"提出主问题","required_assets":[{"type":"a_roll","description":"中文讲述人或头像","source":"record"}]},
    {"id":"s03","type":"diagram","description":"结果、过程、身份三层同心圆","start_seconds":55,"end_seconds":120,"script_section_id":"setup","framing":"wide graphic","movement":"step reveal","transition_in":"dissolve","transition_out":"cut","overlay_notes":"结果 / 过程 / 身份","shot_intent":"给抽象框架一个可记忆结构","narrative_role":"deliver_payload","information_role":"理解改变的三层","required_assets":[{"type":"diagram","description":"三层身份模型","source":"generate"}]},
    {"id":"s04","type":"broll","description":"穿鞋出门跑步，从目标文字切到动作","start_seconds":120,"end_seconds":180,"script_section_id":"setup","framing":"medium to insert","movement":"tracking","transition_in":"cut","transition_out":"dissolve","overlay_notes":"每一次行动，都是给身份投票","shot_intent":"把身份概念落到行为","narrative_role":"evidence","information_role":"身份由重复动作形成","required_assets":[{"type":"image","description":"跑步与日常行动场景图","source":"generate"}]},
    {"id":"s05","type":"broll","description":"书、水杯、手机首页的提示设计对比","start_seconds":180,"end_seconds":250,"script_section_id":"law_one","framing":"top-down inserts","movement":"pan_right","transition_in":"fade","transition_out":"cut","overlay_notes":"先改提示，再谈意志力","shot_intent":"展示显而易见法则","narrative_role":"deliver_payload","information_role":"环境提示影响启动","required_assets":[{"type":"image","description":"提示物件三联图","source":"generate"}]},
    {"id":"s06","type":"diagram","description":"提示→行动的环境路径图","start_seconds":250,"end_seconds":320,"script_section_id":"law_one","framing":"wide graphic","movement":"draw-on","transition_in":"cut","transition_out":"dissolve","overlay_notes":"减少坏提示，增加好提示","shot_intent":"总结第一法则并形成可执行动作","narrative_role":"resolution","information_role":"知道如何改造环境","required_assets":[{"type":"diagram","description":"环境设计流程图","source":"generate"}]},
    {"id":"s07","type":"broll","description":"耳机、咖啡与学习桌组合，展示诱惑绑定","start_seconds":320,"end_seconds":390,"script_section_id":"law_two","framing":"medium close","movement":"slow pan_left","transition_in":"dissolve","transition_out":"cut","overlay_notes":"把需要做的事和喜欢做的事绑定","shot_intent":"让有吸引力变成具体场景","narrative_role":"evidence","information_role":"即时期待提高启动率","required_assets":[{"type":"image","description":"学习与奖励绑定场景","source":"generate"}]},
    {"id":"s08","type":"talking_head","description":"讲述人解释好习惯不等于永远舒服","start_seconds":390,"end_seconds":455,"script_section_id":"law_two","framing":"medium","movement":"static","transition_in":"cut","transition_out":"dissolve","overlay_notes":"好的习惯，是让下一次开始不那么难受","shot_intent":"加入边界和个人判断","narrative_role":"emotional_beat","information_role":"避免鸡汤式误解","required_assets":[{"type":"a_roll","description":"讲述人补充判断","source":"record"}]},
    {"id":"s09","type":"broll","description":"铺瑜伽垫、打开文档、翻开书的两分钟动作","start_seconds":455,"end_seconds":530,"script_section_id":"law_three","framing":"close-up inserts","movement":"quick cuts","transition_in":"dissolve","transition_out":"cut","overlay_notes":"把第一步缩小到两分钟","shot_intent":"展示降低启动成本","narrative_role":"deliver_payload","information_role":"行动可以被缩小","required_assets":[{"type":"image","description":"两分钟启动动作组图","source":"generate"}]},
    {"id":"s10","type":"diagram","description":"大计划缩小为两分钟启动阶梯","start_seconds":530,"end_seconds":600,"script_section_id":"law_three","framing":"wide graphic","movement":"step reveal","transition_in":"cut","transition_out":"dissolve","overlay_notes":"先练习成为一个会开始的人","shot_intent":"把方法变成可复用模板","narrative_role":"resolution","information_role":"掌握缩小动作的方法","required_assets":[{"type":"diagram","description":"启动成本阶梯图","source":"generate"}]},
    {"id":"s11","type":"broll","description":"日历勾选与透明盒中增加回形针","start_seconds":600,"end_seconds":680,"script_section_id":"law_four","framing":"insert macro","movement":"dolly_in","transition_in":"dissolve","transition_out":"cut","overlay_notes":"让进步看得见","shot_intent":"展示反馈回路","narrative_role":"evidence","information_role":"记录让进步可见","required_assets":[{"type":"image","description":"习惯追踪视觉隐喻","source":"generate"}]},
    {"id":"s12","type":"text_card","description":"一次失败是事件，连续放弃才会变成模式","start_seconds":680,"end_seconds":745,"script_section_id":"law_four","framing":"centered card","movement":"gentle scale","transition_in":"cut","transition_out":"fade","overlay_notes":"不要连续错过两次","shot_intent":"给观众一个可记忆规则","narrative_role":"deliver_payload","information_role":"降低失败后的羞耻感","required_assets":[{"type":"text_card","description":"关键句卡片","source":"generate"}]},
    {"id":"s13","type":"talking_head","description":"讲述人说明方法边界与结构性限制","start_seconds":745,"end_seconds":875,"script_section_id":"limits","framing":"medium close-up","movement":"static","transition_in":"fade","transition_out":"dissolve","overlay_notes":"方法有效，但不是万能公式","shot_intent":"建立可信度并避免过度承诺","narrative_role":"comparison","information_role":"知道方法适用边界","required_assets":[{"type":"a_roll","description":"审慎说明与观点","source":"record"}]},
    {"id":"s14","type":"diagram","description":"七天行动清单：身份、两分钟、提示、绑定、记录、准备、复盘","start_seconds":875,"end_seconds":1035,"script_section_id":"action","framing":"wide checklist","movement":"progressive reveal","transition_in":"dissolve","transition_out":"cut","overlay_notes":"7天，只改一个习惯","shot_intent":"把全书转成低摩擦行动计划","narrative_role":"call_to_action","information_role":"获得可执行步骤","required_assets":[{"type":"diagram","description":"七天行动清单图","source":"generate"}]},
    {"id":"s15","type":"broll","description":"晨光中完成一个小动作，回到开场生活场景","start_seconds":1035,"end_seconds":1120,"script_section_id":"payoff","framing":"medium wide","movement":"steadicam","transition_in":"dissolve","transition_out":"fade","overlay_notes":"从一个小动作开始","shot_intent":"形成情绪回升和视觉回扣","narrative_role":"resolution","information_role":"改变可以从今天开始","hero_moment":true,"required_assets":[{"type":"image","description":"晨光与小行动场景","source":"generate"}]},
    {"id":"s16","type":"text_card","description":"每一次重复，都是一张投票","start_seconds":1120,"end_seconds":1200,"script_section_id":"payoff","framing":"centered hero card","movement":"slow zoom_in","transition_in":"fade","transition_out":"fade","overlay_notes":"你最想改变的那个习惯是什么？","shot_intent":"留下记忆点并引导评论","narrative_role":"call_to_action","information_role":"完成主题回扣","hero_moment":true,"required_assets":[{"type":"text_card","description":"结尾主题卡","source":"generate"}]}
  ],
  "metadata": {"target_duration_seconds":1200,"duration_range_seconds":[1080,1500],"estimated_still_images":40,"a_roll_ratio":0.25,"b_roll_ratio":0.5,"motion_graphics_ratio":0.25,"ai_video_default":false,"visual_rule":"No more than two consecutive static image beats"}
}
